Index,question,answer
1,"hi, how are you doing?",i'm fine. how about yourself?
2,i'm fine. how about yourself?,i'm pretty good. thanks for asking.
3,i'm pretty good. thanks for asking.,no problem. so how have you been?
4,no problem. so how have you been?,i've been great. what about you?
5,i've been great. what about you?,i've been good. i'm in school right now.
6,i've been good. i'm in school right now.,what school do you go to?
7,what school do you go to?,i go to pcc.
8,i go to pcc.,do you like it there?
9,do you like it there?,it's okay. it's a really big campus.
10,it's okay. it's a really big campus.,good luck with school.
11,good luck with school.,thank you very much.
12,how's it going?,i'm doing well. how about you?
13,i'm doing well. how about you?,"never better, thanks."
14,"never better, thanks.",so how have you been lately?
15,so how have you been lately?,i've actually been pretty good. you?
16,i've actually been pretty good. you?,i'm actually in school right now.
17,i'm actually in school right now.,which school do you attend?
18,which school do you attend?,i'm attending pcc right now.
19,i'm attending pcc right now.,are you enjoying it there?
20,are you enjoying it there?,it's not bad. there are a lot of people there.
21,it's not bad. there are a lot of people there.,good luck with that.
22,good luck with that.,thanks.
23,how are you doing today?,i'm doing great. what about you?
24,i'm doing great. what about you?,"i'm absolutely lovely, thank you."
25,"i'm absolutely lovely, thank you.",everything's been good with you?
26,everything's been good with you?,i haven't been better. how about yourself?
27,i haven't been better. how about yourself?,i started school recently.
28,i started school recently.,where are you going to school?
29,where are you going to school?,i'm going to pcc.
30,i'm going to pcc.,how do you like it so far?
31,how do you like it so far?,i like it so far. my classes are pretty good right now.
32,i like it so far. my classes are pretty good right now.,i wish you luck.
33,it's an ugly day today.,i know. i think it may rain.
34,i know. i think it may rain.,"it's the middle of summer, it shouldn't rain today."
35,"it's the middle of summer, it shouldn't rain today.",that would be weird.
36,that would be weird.,"yeah, especially since it's ninety degrees outside."
37,"yeah, especially since it's ninety degrees outside.","i know, it would be horrible if it rained and it was hot outside."
38,"i know, it would be horrible if it rained and it was hot outside.","yes, it would be."
39,"yes, it would be.",i really wish it wasn't so hot every day.
40,i really wish it wasn't so hot every day.,me too. i can't wait until winter.
41,me too. i can't wait until winter.,"i like winter too, but sometimes it gets too cold."
42,"i like winter too, but sometimes it gets too cold.",i'd rather be cold than hot.
43,i'd rather be cold than hot.,me too.
44,it doesn't look very nice outside today.,you're right. i think it's going to rain later.
45,you're right. i think it's going to rain later.,"in the middle of the summer, it shouldn't be raining."
46,"in the middle of the summer, it shouldn't be raining.",that wouldn't seem right.
47,that wouldn't seem right.,"considering that it's over ninety degrees outside, that would be weird."
48,"considering that it's over ninety degrees outside, that would be weird.","exactly, it wouldn't be nice if it started raining. it's too hot."
49,"exactly, it wouldn't be nice if it started raining. it's too hot.","i know, you're absolutely right."
50,"i know, you're absolutely right.",i wish it would cool off one day.
51,i wish it would cool off one day.,"that's how i feel, i want winter to come soon."
52,"that's how i feel, i want winter to come soon.","i enjoy the winter, but it gets really cold sometimes."
53,"i enjoy the winter, but it gets really cold sometimes.","i know what you mean, but i'd rather be cold than hot."
54,"i know what you mean, but i'd rather be cold than hot.",that's exactly how i feel.
55,i wish it was a nicer day today.,that is true. i hope it doesn't rain.
56,that is true. i hope it doesn't rain.,it wouldn't rain in the middle of the summer.
57,it wouldn't rain in the middle of the summer.,it wouldn't seem right if it started raining right now.
58,it wouldn't seem right if it started raining right now.,it would be weird if it started raining in ninety degree weather.
59,it would be weird if it started raining in ninety degree weather.,any rain right now would be pointless.
60,any rain right now would be pointless.,"that's right, it really would be."
61,"that's right, it really would be.",i want it to cool down some.
62,i want it to cool down some.,"i know what you mean, i can't wait until it's winter."
63,"i know what you mean, i can't wait until it's winter.",winter is great. i wish it didn't get so cold sometimes though.
64,winter is great. i wish it didn't get so cold sometimes though.,i would rather deal with the winter than the summer.
65,it's such a nice day.,"yes, it is."
66,"yes, it is.",it looks like it may rain soon.
67,it looks like it may rain soon.,"yes, and i hope that it does."
68,"yes, and i hope that it does.",why is that?
69,why is that?,i really love how rain clears the air.
70,i really love how rain clears the air.,me too. it always smells so fresh after it rains.
71,me too. it always smells so fresh after it rains.,"yes, but i love the night air after it rains."
72,"yes, but i love the night air after it rains.",really? why is it?
73,really? why is it?,because you can see the stars perfectly.
74,because you can see the stars perfectly.,i really hope it rains today.
75,i really hope it rains today.,"yeah, me too."
76,isn't it a nice day?,it really is.
77,it really is.,it seems that it may rain today.
78,it seems that it may rain today.,hopefully it will.
79,hopefully it will.,how come?
80,how come?,i like how clear the sky gets after it rains.
81,i like how clear the sky gets after it rains.,i feel the same way. it smells so good after it rains.
82,i feel the same way. it smells so good after it rains.,i especially love the night air when it rains.
83,i especially love the night air when it rains.,really? why?
84,really? why?,the stars look so much closer after it rains.
85,the stars look so much closer after it rains.,i really want it to rain today.
86,i really want it to rain today.,"yeah, so do i."
87,don't you think it's nice out?,"yes, i think so too."
88,"yes, i think so too.",i think that it's going to rain.
89,i think that it's going to rain.,i hope that it does rain.
90,i hope that it does rain.,you like the rain?
91,you like the rain?,the sky looks so clean after it rains. i love it.
92,the sky looks so clean after it rains. i love it.,i understand. rain does make it smell cleaner.
93,i understand. rain does make it smell cleaner.,i love most how it is at night after it rains.
94,i love most how it is at night after it rains.,how come?
95,how come?,you can see the stars so much more clearly after it rains.
96,you can see the stars so much more clearly after it rains.,i would love for it to rain today.
97,i really want to go to the beach this weekend.,that sounds like fun. what's the weather going to be like?
98,that sounds like fun. what's the weather going to be like?,i heard that it's going to be warm this weekend.
99,i heard that it's going to be warm this weekend.,is it going to be perfect beach weather?
100,is it going to be perfect beach weather?,i believe so.
101,i believe so.,good. i hope it doesn't cool off this weekend.
102,good. i hope it doesn't cool off this weekend.,i know. i really want to go to the beach.
103,i know. i really want to go to the beach.,but you know that california weather is really unpredictable.
104,but you know that california weather is really unpredictable.,"you're right. one minute it's hot, and then the next minute it's cold."
105,"you're right. one minute it's hot, and then the next minute it's cold.",i really wish the weather would just stay the same.
106,i really wish the weather would just stay the same.,i do too. that way we can have our activities planned ahead of time.
107,i do too. that way we can have our activities planned ahead of time.,"yeah, that would make things a lot easier."
108,i would like to take a trip to the beach this weekend.,a trip to the beach would be fun. how is the weather going to be?
109,a trip to the beach would be fun. how is the weather going to be?,the forecast says that it will be warm on the weekend.
110,the forecast says that it will be warm on the weekend.,so do you think it'll be perfect weather for the beach?
111,so do you think it'll be perfect weather for the beach?,it sounds like it will be.
112,it sounds like it will be.,i really hope it doesn't get cold.
113,i really hope it doesn't get cold.,"that would ruin things, i want to go so badly."
114,"that would ruin things, i want to go so badly.","the weather in california is unpredictable, so you never know."
115,"the weather in california is unpredictable, so you never know.",that is true. the weather is constantly changing.
116,that is true. the weather is constantly changing.,it would be nice if the weather would never change.
117,it would be nice if the weather would never change.,"that would be great, then we could plan things sooner."
118,"that would be great, then we could plan things sooner.",true. predictable weather would make life easier.
119,it would be nice to go to the beach sometime this weekend.,what's the weather going to be like? i may want to go too.
120,what's the weather going to be like? i may want to go too.,the weather this weekend is supposed to be warm.
121,the weather this weekend is supposed to be warm.,will it be good beach weather?
122,will it be good beach weather?,i think it will be.
123,i think it will be.,it wouldn't be good if it got cold this weekend.
124,it wouldn't be good if it got cold this weekend.,"i want this trip to be perfect, i hope it stays warm."
125,"i want this trip to be perfect, i hope it stays warm.","this california weather is so uncertain, it's impossible to know what'll happen."
126,"this california weather is so uncertain, it's impossible to know what'll happen.",i know. every day the weather seems different.
127,i know. every day the weather seems different.,i would love it if it wasn't always so unpredictable.
128,i would love it if it wasn't always so unpredictable.,that would make it easier for us to make plans.
129,"hello, may i speak to alice please?",this is she. how's it going?
130,this is she. how's it going?,i've been trying to call you all day.
131,i've been trying to call you all day.,sorry about that. i was cleaning up.
132,sorry about that. i was cleaning up.,it's okay.
133,it's okay.,so what were you calling me about?
134,so what were you calling me about?,"oh, i just wanted to see if you wanted to hang out tomorrow."
135,"oh, i just wanted to see if you wanted to hang out tomorrow.","sure, what did you want to do?"
136,"sure, what did you want to do?",maybe we can go see a movie or something.
137,maybe we can go see a movie or something.,that sounds like fun. let's do it.
138,that sounds like fun. let's do it.,i'll see you tomorrow then.
139,i'll see you tomorrow then.,see you then. goodbye.
140,"hi, how are you. is alice there?",speaking. what's up?
141,speaking. what's up?,why haven't you answered the phone?
142,why haven't you answered the phone?,"my bad, i had chores to do."
143,"my bad, i had chores to do.",that's all right.
144,that's all right.,what was the reason for your call?
145,what was the reason for your call?,i want to do something tomorrow with you.
146,i want to do something tomorrow with you.,sounds good. what did you have in mind?
147,sounds good. what did you have in mind?,i was thinking about seeing a movie.
148,i was thinking about seeing a movie.,"okay, let's go see a movie."
149,"okay, let's go see a movie.",until then.
150,until then.,talk to you later.
151,is alice available?,you're talking to her.
152,you're talking to her.,i've called you a hundred times today.
153,i've called you a hundred times today.,i was busy doing something. i apologize.
154,i was busy doing something. i apologize.,no problem.
155,no problem.,did you need something?
156,did you need something?,do you want to do something tomorrow?
157,do you want to do something tomorrow?,is there somewhere special you wanted to go?
158,is there somewhere special you wanted to go?,how about a movie?
159,how about a movie?,a movie sounds good.
160,a movie sounds good.,call me tomorrow then.
161,have you seen the new girl in school?,"no, i haven't."
162,"no, i haven't.",she's really pretty.
163,she's really pretty.,describe her to me.
164,describe her to me.,she's not too tall.
165,she's not too tall.,"well, how tall is she?"
166,"well, how tall is she?",she's about five feet even.
167,she's about five feet even.,"what does she look like, though?"
168,"what does she look like, though?",she has pretty light brown eyes.
169,she has pretty light brown eyes.,i may know which girl you're talking about.
170,i may know which girl you're talking about.,so you have seen her around?
171,so you have seen her around?,"yes, i have."
172,"there's a new girl in school, have you seen her yet?",i haven't seen her yet.
173,i haven't seen her yet.,i think that she is very pretty.
174,i think that she is very pretty.,tell me how she looks.
175,tell me how she looks.,she's kind of short.
176,she's kind of short.,what height is she?
177,what height is she?,she's probably about five feet.
178,she's probably about five feet.,"that's nice, but tell me what she looks like."
179,"that's nice, but tell me what she looks like.",the first thing i noticed was her beautiful brown eyes.
180,the first thing i noticed was her beautiful brown eyes.,i think i might've bumped into her before.
181,i think i might've bumped into her before.,are you telling me that you've seen her before?
182,are you telling me that you've seen her before?,i believe so.
183,have you met the new girl?,no. have you?
184,no. have you?,she's one of the prettiest girls at the school.
185,she's one of the prettiest girls at the school.,what does she look like?
186,what does she look like?,"well, she's quite short."
187,"well, she's quite short.",how tall would you say that she is?
188,how tall would you say that she is?,i would say she's only five feet.
189,i would say she's only five feet.,what about her facial features?
190,what about her facial features?,"she has light brown eyes, absolutely beautiful."
191,"she has light brown eyes, absolutely beautiful.",i think i know who you're talking about.
192,i think i know who you're talking about.,have you seen her?
193,why weren't you at school yesterday?,i wasn't really feeling well.
194,i wasn't really feeling well.,what was wrong with you?
195,what was wrong with you?,my stomach was upset.
196,my stomach was upset.,do you feel better now?
197,do you feel better now?,i don't really feel too well yet.
198,i don't really feel too well yet.,do you want anything to make you feel better?
199,do you want anything to make you feel better?,"no, thanks. i already took some medicine."
200,"no, thanks. i already took some medicine.",i hope you feel better.
201,i hope you feel better.,thank you.
202,what reason do you have for missing school?,i was sick.
203,i was sick.,how were you sick?
204,how were you sick?,i had a stomachache.
205,i had a stomachache.,did it get any better?
206,did it get any better?,i'm still feeling under the weather.
207,i'm still feeling under the weather.,would you like anything for your stomach?
208,would you like anything for your stomach?,i took something earlier.
209,i took something earlier.,get better.
210,get better.,thanks a lot.
211,why didn't you go to school yesterday?,i stayed home because i wasn't feeling well.
212,i stayed home because i wasn't feeling well.,what was your problem?
213,what was your problem?,my stomach was bothering me.
214,my stomach was bothering me.,are you feeling any better?
215,are you feeling any better?,i'm still feeling a little sick.
216,i'm still feeling a little sick.,"i'm going to the store, would you like any pepto bismol?"
217,"i'm going to the store, would you like any pepto bismol?",that's okay.
218,that's okay.,i hope you feel better.
219,did you hear the good news?,"no, i haven't."
220,"no, i haven't.",i got a promotion at my job.
221,i got a promotion at my job.,did you really?
222,did you really?,"seriously, i am so excited."
223,"seriously, i am so excited.","well, congratulations."
224,"well, congratulations.",thank you.
225,thank you.,i'm so happy for you.
226,i'm so happy for you.,really?
227,really?,yes. you really deserved this.
228,yes. you really deserved this.,you think so?
229,you think so?,yes. good for you.
230,have you heard my good news?,you haven't told me anything yet.
231,you haven't told me anything yet.,i got a promotion at work earlier this week.
232,i got a promotion at work earlier this week.,is that right?
233,is that right?,it's the truth. i am really happy.
234,it's the truth. i am really happy.,congratulations on your promotion.
235,congratulations on your promotion.,thank you very much.
236,thank you very much.,i am really excited for you.
237,i am really excited for you.,are you really?
238,are you really?,i'm serious. you deserved this promotion.
239,i'm serious. you deserved this promotion.,is that what you really think?
240,is that what you really think?,"yes, i do."
241,"i haven't told you what happened yet, have i?",i haven't heard anything.
242,i haven't heard anything.,"my boss offered me a promotion, and i took it."
243,"my boss offered me a promotion, and i took it.",are you serious?
244,are you serious?,"yes, i am really excited."
245,"yes, i am really excited.",that's great. congratulations.
246,that's great. congratulations.,i appreciate that.
247,i appreciate that.,you have no idea how happy i am for you.
248,you have no idea how happy i am for you.,for real?
249,you look really nice today.,thank you. i just got this outfit the other day.
250,thank you. i just got this outfit the other day.,"really, where did you get it?"
251,"really, where did you get it?",i got it from macy's.
252,i got it from macy's.,it's really nice.
253,it's really nice.,"thanks again. you look nice today, too."
254,"thanks again. you look nice today, too.",thank you. i just got these shoes today.
255,thank you. i just got these shoes today.,really? what kind of shoes are they?
256,really? what kind of shoes are they?,these are called all star chuck taylors.
257,these are called all star chuck taylors.,i really like those. how much did they cost?
258,i really like those. how much did they cost?,they were about forty dollars.
259,they were about forty dollars.,i think i'm going to go buy myself a pair.
260,i absolutely love what you're wearing today.,you do? i just bought this outfit a couple days ago.
261,you do? i just bought this outfit a couple days ago.,"seriously, it looks really nice on you. where did you buy it from?"
262,"seriously, it looks really nice on you. where did you buy it from?",i bought it from the macy's at the santa anita mall.
263,i bought it from the macy's at the santa anita mall.,i really like that outfit.
264,i really like that outfit.,"thanks. i think you look nice today, too."
265,"thanks. i think you look nice today, too.",thank you. i just bought these new shoes earlier today.
266,thank you. i just bought these new shoes earlier today.,those are nice. what are they?
267,those are nice. what are they?,these are some chucks.
268,these are some chucks.,those are great. how much were they?
269,those are great. how much were they?,i got them for forty.
270,i got them for forty.,i think i might go and find me my own pair of chucks.
271,i think that you look very cute today.,is that right? this is a brand new outfit.
272,is that right? this is a brand new outfit.,what store did you get it from?
273,what store did you get it from?,i went to macy's and picked it out.
274,i went to macy's and picked it out.,i love your outfit right now.
275,i love your outfit right now.,"well, i think you look nice today too."
276,"well, i think you look nice today too.",thanks. i found these new shoes earlier at the store.
277,thanks. i found these new shoes earlier at the store.,i think that those are some really nice shoes. what kind are they?
278,i think that those are some really nice shoes. what kind are they?,these are chucks.
279,these are chucks.,your shoes look really nice. how much did you get them for?
280,your shoes look really nice. how much did you get them for?,they only cost me about forty dollars.
281,"tell me, what do you enjoy doing in your spare time?",i enjoy drawing and painting.
282,i enjoy drawing and painting.,you know how to draw and paint?
283,you know how to draw and paint?,"yes, i do."
284,"yes, i do.",when did you learn how to do that?
285,when did you learn how to do that?,i learned back in high school.
286,i learned back in high school.,"oh, so you took an art class?"
287,"oh, so you took an art class?","yeah, i loved that class."
288,"yeah, i loved that class.",i see that you're pretty talented.
289,i see that you're pretty talented.,thank you very much.
290,thank you very much.,i wish i had a talent like that.
291,i wish i had a talent like that.,i'm sure you have a talent. it's just hidden.
292,what kinds of things do you like to do?,i've always liked to draw and paint.
293,i've always liked to draw and paint.,i didn't know you knew how to draw and paint.
294,i didn't know you knew how to draw and paint.,i do it every once in a while.
295,i do it every once in a while.,how long have you known how to do that?
296,how long have you known how to do that?,i first learned how to do it in high school.
297,i first learned how to do it in high school.,did you take some sort of art class or something?
298,did you take some sort of art class or something?,that was my favorite class.
299,that was my favorite class.,you have got to be talented.
300,you have got to be talented.,thanks.
301,thanks.,if only i was talented.
302,if only i was talented.,you have a talent. you just don't know what it is yet.
303,are there any hobbies you do?,"when i have time, i sometimes draw and paint."
304,"when i have time, i sometimes draw and paint.","oh, you actually do that?"
305,"oh, you actually do that?","every so often, i do."
306,"every so often, i do.",did you always know how to draw and paint?
307,did you always know how to draw and paint?,i was taught in high school how to draw and paint.
308,i was taught in high school how to draw and paint.,you had an art class?
309,you had an art class?,"exactly, it was my favorite class."
310,"exactly, it was my favorite class.","well, it's good that you're so talented."
311,"well, it's good that you're so talented.",i appreciate that.
312,i appreciate that.,"talent is a great thing, i wish i had one."
313,what's your favorite movie?,my favorite movie is superbad.
314,my favorite movie is superbad.,"oh, why is that?"
315,"oh, why is that?",it's the funniest movie that i've ever seen.
316,it's the funniest movie that i've ever seen.,that's true. it is a very funny movie.
317,that's true. it is a very funny movie.,you've seen it before?
318,you've seen it before?,"yes, i saw that movie the first day it came out in theaters."
319,"yes, i saw that movie the first day it came out in theaters.",didn't you laugh through the whole movie? i did.
320,didn't you laugh through the whole movie? i did.,me too. that movie brought tears to my eyes.
321,me too. that movie brought tears to my eyes.,mine too.
322,mine too.,i have it on dvd at my house if you want to come over and watch it.
323,i have it on dvd at my house if you want to come over and watch it.,"sure, let's go."
324,which movie is your favorite to watch?,"i have to say, my favorite movie is superbad."
325,"i have to say, my favorite movie is superbad.",is that right? why?
326,is that right? why?,"honestly, it is one of the funniest movies i've seen in a long time."
327,"honestly, it is one of the funniest movies i've seen in a long time.",you're right. that movie is hilarious.
328,you're right. that movie is hilarious.,i didn't think you saw that movie.
329,i didn't think you saw that movie.,i went to see it the day it came out.
330,i went to see it the day it came out.,i was laughing through the whole movie.
331,i was laughing through the whole movie.,"i couldn't help laughing, either."
332,"i couldn't help laughing, either.",same here.
333,same here.,i bought the movie. would you like to come to my house and watch it?
334,i bought the movie. would you like to come to my house and watch it?,of course.
335,"out of every movie that you've seen, which one is your favorite?",i'm going to have to say that superbad is the best movie ever.
336,i'm going to have to say that superbad is the best movie ever.,"you think so, how come?"
337,"you think so, how come?","well, superbad is super funny."
338,"well, superbad is super funny.","you're not lying, i found that movie absolutely hilarious."
339,"you're not lying, i found that movie absolutely hilarious.",i didn't know that you saw superbad before.
340,i didn't know that you saw superbad before.,i made sure to be in line to see it the first day it came out.
341,i made sure to be in line to see it the first day it came out.,i couldn't keep from laughing throughout the whole movie.
