Index,question,answer
1852,why are you complaining? we're going almost 20 miles an hour.,the speed limit is 65!
1853,the speed limit is 65!,"well, that's between 2:00 and 4:00 a.m."
1854,"well, that's between 2:00 and 4:00 a.m.",where are all these people going?
1855,where are all these people going?,they're all asking the same question.
1856,they're all asking the same question.,when are they going to fix this problem?
1857,when are they going to fix this problem?,they said they need more money.
1858,they said they need more money.,they always need more money.
1859,they always need more money.,it'll get worse before it gets better.
1860,did you see that car?,"yes, he went through the red light."
1861,"yes, he went through the red light.",can we call the police?
1862,can we call the police?,"no, the police don't care."
1863,"no, the police don't care.",why not?
1864,why not?,they have to see it happen.
1865,they have to see it happen.,they don't believe us?
1866,they don't believe us?,no. they can only give a ticket if they see it happen.
1867,no. they can only give a ticket if they see it happen.,"so, what do we do?"
1868,"so, what do we do?",we don't do anything.
1869,we don't do anything.,maybe we should honk the horn next time.
1870,maybe we should honk the horn next time.,the driver will just honk back at us.
1871,my car is dirty.,why don't you wash it?
1872,why don't you wash it?,that's what i'm going to do.
1873,that's what i'm going to do.,are you going to wash it yourself?
1874,are you going to wash it yourself?,of course. it's not a hard job.
1875,of course. it's not a hard job.,i'll help you.
1876,i'll help you.,"okay, i'll get a bucket."
1877,"okay, i'll get a bucket.",i'll rinse the car first.
1878,i'll rinse the car first.,then we can scrub it with a wet sponge and soap.
1879,then we can scrub it with a wet sponge and soap.,"after that, we can dry it with a towel."
1880,"after that, we can dry it with a towel.",then it will look like new
1881,then it will look like new,and you save $10.
1882,it sure is windy today.,paper is flying everywhere.
1883,paper is flying everywhere.,this wind is dangerous for drivers.
1884,this wind is dangerous for drivers.,especially for drivers of big trucks.
1885,especially for drivers of big trucks.,the wind blows those trucks over.
1886,the wind blows those trucks over.,"it blows trees over, too."
1887,"it blows trees over, too.",a tree fell onto my dad's car.
1888,a tree fell onto my dad's car.,was there much damage?
1889,was there much damage?,my dad had to buy a new car.
1890,my dad had to buy a new car.,wow! that's terrible.
1891,wow! that's terrible.,never park your car under a tree.
1892,never park your car under a tree.,"the wind will get you, or the birds will get you."
1893,when are we going to stop?,we'll stop at the next mcdonald's.
1894,we'll stop at the next mcdonald's.,how far away is that?
1895,how far away is that?,i think we'll be there in half an hour.
1896,i think we'll be there in half an hour.,i hope so. i have to go to the bathroom.
1897,i hope so. i have to go to the bathroom.,"well, i can always pull over."
1898,"well, i can always pull over.","no, thank you, i'll just wait."
1899,"no, thank you, i'll just wait.",we can kill two birds with one stone.
1900,we can kill two birds with one stone.,what do you mean?
1901,what do you mean?,"while you're using the bathroom, i'll order some food."
1902,"while you're using the bathroom, i'll order some food.",don't order for me. i'm not hungry.
1903,don't order for me. i'm not hungry.,"i'm very hungry. i'll order for you, and then i'll eat yours."
1904,this is such a long light.,look how many cars are waiting in line.
1905,look how many cars are waiting in line.,they need a left-turn arrow.
1906,they need a left-turn arrow.,only two cars can make a left turn every three or four minutes.
1907,only two cars can make a left turn every three or four minutes.,we'll be here forever.
1908,we'll be here forever.,get out of this lane.
1909,get out of this lane.,but we need to turn left.
1910,but we need to turn left.,forget it. go straight.
1911,forget it. go straight.,then what?
1912,then what?,then we'll just make a u-turn.
1913,then we'll just make a u-turn.,and then we can turn right at the light.
1914,and then we can turn right at the light.,good idea. it will be so much quicker.
1915,i need a cheap car.,how much money do you have?
1916,how much money do you have?,"$1,000.00"
1917,"$1,000.00","well, that should get you something."
1918,"well, that should get you something.",but i need something that's reliable.
1919,but i need something that's reliable.,you need a car with low mileage.
1920,you need a car with low mileage.,a car that was owned by a little old lady.
1921,a car that was owned by a little old lady.,where have you looked?
1922,where have you looked?,i haven't looked anywhere yet.
1923,i haven't looked anywhere yet.,why not?
1924,why not?,because i'll never find one for such a low price.
1925,because i'll never find one for such a low price.,you're right about that. keep saving your money.
1926,"good afternoon, officer.","your driver's license and registration, please."
1927,"your driver's license and registration, please.",here you go.
1928,here you go.,do you know why i pulled you over?
1929,do you know why i pulled you over?,i have no idea. all of a sudden i heard your siren.
1930,i have no idea. all of a sudden i heard your siren.,you rolled through that stop sign back there.
1931,you rolled through that stop sign back there.,but i stopped!
1932,but i stopped!,"no, you didn't. you slowed down, but you didn't come to a full stop."
1933,"no, you didn't. you slowed down, but you didn't come to a full stop.","well, nobody else does, so why should i?"
1934,"well, nobody else does, so why should i?",that's not the attitude of a good driver.
1935,that's not the attitude of a good driver.,but i am a good driver. i've never had a ticket in my life.
1936,but i am a good driver. i've never had a ticket in my life.,"well, you've got one now. here. have a nice day."
1937,$140. i can't believe it.,what are you talking about?
1938,what are you talking about?,i got a ticket downtown for $140.
1939,i got a ticket downtown for $140.,were you speeding?
1940,were you speeding?,"no, i was crossing the street."
1941,"no, i was crossing the street.",were you jaywalking?
1942,were you jaywalking?,"no, i was in the crosswalk."
1943,"no, i was in the crosswalk.",so why did you get a ticket?
1944,so why did you get a ticket?,the officer said the red hand was blinking.
1945,the officer said the red hand was blinking.,was it blinking when you entered the crosswalk?
1946,was it blinking when you entered the crosswalk?,"no, the white walk sign was blinking."
1947,"no, the white walk sign was blinking.",you should fight that ticket. i'll be your witness.
1948,they were in a crosswalk near school at 3 a.m.,who?
1949,who?,two students from usc.
1950,two students from usc.,what happened?
1951,what happened?,"a speeding car ran a red light, killing the girl."
1952,"a speeding car ran a red light, killing the girl.",what happened to the other student?
1953,what happened to the other student?,he landed on the hood of the car.
1954,he landed on the hood of the car.,did he get off the hood?
1955,did he get off the hood?,"no, the car stopped and the passenger pushed the injured student off the hood."
1956,"no, the car stopped and the passenger pushed the injured student off the hood.",i'll bet the car continued on its way.
1957,i'll bet the car continued on its way.,of course it did. why stop after you've run over two people?
1958,of course it did. why stop after you've run over two people?,i hope they find them and put them in jail for life.
1959,what happened to your car?,i got a dent in the parking lot.
1960,i got a dent in the parking lot.,how did you get it?
1961,how did you get it?,i don't know. maybe it was from a shopping cart.
1962,i don't know. maybe it was from a shopping cart.,those shopping carts are dangerous.
1963,those shopping carts are dangerous.,especially the metal ones.
1964,especially the metal ones.,i don't park at a store that uses metal shopping carts.
1965,i don't park at a store that uses metal shopping carts.,"that's a good idea, but there was a good sale at this store."
1966,"that's a good idea, but there was a good sale at this store.",did you save any money on the sale?
1967,did you save any money on the sale?,"yes, i did. i saved about $50."
1968,"yes, i did. i saved about $50.",that's great.
1969,that's great.,"yes, except this dent will cost about $150."
1970,"did you see ""titanic""?",yes. it is a great movie.
1971,yes. it is a great movie.,i saw it twelve times.
1972,i saw it twelve times.,i saw it eight times.
1973,i saw it eight times.,i have the dvd.
1974,i have the dvd.,so do i.
1975,so do i.,let's go to your home.
1976,let's go to your home.,we can watch my dvd.
1977,we can watch my dvd.,and then we can go to my home.
1978,and then we can go to my home.,and watch your dvd.
1979,and watch your dvd.,i always cry at the end.
1980,i always cry at the end.,me too. it's so sad.
1981,let's play cards.,i don't know any card games.
1982,i don't know any card games.,i'll teach you one.
1983,i'll teach you one.,okay. what will you teach me?
1984,okay. what will you teach me?,it's called poker.
1985,it's called poker.,is it easy to learn?
1986,is it easy to learn?,"yes, it will only take about 30 minutes."
1987,"yes, it will only take about 30 minutes.",okay. teach me how to play.
1988,okay. teach me how to play.,we each get five cards.
1989,we each get five cards.,"oh, look. i have four tens."
1990,"oh, look. i have four tens.","that's great, but you're not supposed to tell me."
1991,"that's great, but you're not supposed to tell me.","oh. sorry. okay, i don't have four tens."
1992,i'm a good card player.,why is that?
1993,why is that?,because i watch the other players.
1994,because i watch the other players.,what do you mean?
1995,what do you mean?,people will tell you if they have a good hand.
1996,people will tell you if they have a good hand.,how do they do that?
1997,how do they do that?,"for example, a friend of mine licks his lips."
1998,"for example, a friend of mine licks his lips.","when he licks his lips, you know he has a good hand?"
1999,"when he licks his lips, you know he has a good hand?","i know he has a good hand, so i don't bet."
2000,"i know he has a good hand, so i don't bet.",he never wins your money?
2001,he never wins your money?,"nope, and it drives him crazy."
2002,"nope, and it drives him crazy.",he knows you can't read his mind. maybe he thinks you're cheating.
2003,"turn the radio down, please.",but i'm listening to it.
2004,but i'm listening to it.,"well, listen to it more quietly."
2005,"well, listen to it more quietly.",i can't wait till i grow up.
2006,i can't wait till i grow up.,what will you do?
2007,what will you do?,i will play the radio as loud as i want.
2008,i will play the radio as loud as i want.,that's okay with me.
2009,that's okay with me.,i will have a radio in every room of my house.
2010,i will have a radio in every room of my house.,remind me to never visit you.
2011,remind me to never visit you.,all the radios will be on extra loud.
2012,all the radios will be on extra loud.,your neighbors will hate you.
2013,your neighbors will hate you.,"if they don't like it, they can move."
2014,i hope i win the lotto.,your chances are very small.
2015,your chances are very small.,but you can't win if you don't play.
2016,but you can't win if you don't play.,ha! you can't win if you do play.
2017,ha! you can't win if you do play.,someone has to win.
2018,someone has to win.,that's what everyone says.
2019,that's what everyone says.,it might as well be me.
2020,it might as well be me.,that's what everyone says.
2021,that's what everyone says.,you're trying to tell me something.
2022,you're trying to tell me something.,that didn't take long.
2023,that didn't take long.,you think i should quit playing.
2024,you think i should quit playing.,save your money for school.
2025,what's on tv?,nothing much.
2026,nothing much.,what about the baseball game?
2027,what about the baseball game?,it got rained out.
2028,it got rained out.,rained out?
2029,rained out?,"yes, rained out."
2030,"yes, rained out.",how could that be?
2031,how could that be?,"well, you can't play baseball in a rainstorm."
2032,"well, you can't play baseball in a rainstorm.",i thought they were playing under a dome.
2033,i thought they were playing under a dome.,the dome doesn't close.
2034,the dome doesn't close.,why doesn't it close?
2035,why doesn't it close?,who knows? they said they'll fix it before next season.
2036,can i try your coffee?,sure. here you go.
2037,sure. here you go.,"hmm, that's not bad."
2038,"hmm, that's not bad.",there's nothing in it.
2039,there's nothing in it.,what do you mean?
2040,what do you mean?,"i mean, it's just coffee."
2041,"i mean, it's just coffee.",i figured that.
2042,i figured that.,it's not too bitter for you?
2043,it's not too bitter for you?,"it's a little bitter, but it's okay."
2044,"it's a little bitter, but it's okay.",there's no sugar or cream in it.
2045,there's no sugar or cream in it.,"no, it's a taste you have to get used to."
2046,"no, it's a taste you have to get used to.",sort of like beer.
2047,let's take a walk.,what's the weather like?
2048,what's the weather like?,let me step outside and see.
2049,let me step outside and see.,"it's a little chilly, right?"
2050,"it's a little chilly, right?","yes, it is."
2051,"yes, it is.",i'll put on my cap.
2052,i'll put on my cap.,"wear a jacket, too."
2053,"wear a jacket, too.",i wonder if i should bring my gloves.
2054,i wonder if i should bring my gloves.,"maybe you should, just in case it gets colder."
2055,"maybe you should, just in case it gets colder.",i'll put a glove in each pocket.
2056,i'll put a glove in each pocket.,we'll get warmer as we walk.
2057,we'll get warmer as we walk.,"yes, but it gets colder as the sun goes down."
2058,look at the car chase on tv!,that driver is crazy.
2059,that driver is crazy.,i can't believe he hasn't crashed.
2060,i can't believe he hasn't crashed.,how fast is he going?
2061,how fast is he going?,they say he's going 80 miles per hour.
2062,they say he's going 80 miles per hour.,he's going to kill someone.
2063,he's going to kill someone.,look! he just hit that car.
2064,look! he just hit that car.,"oh, my goodness. no one is safe on the streets."
2065,"oh, my goodness. no one is safe on the streets.",now he's slowing down.
2066,now he's slowing down.,maybe he ran out of gas.
2067,maybe he ran out of gas.,look! he just got out of the car and started running.
2068,look! he just got out of the car and started running.,i hope the police catch him.
2069,tv news is so stupid.,they shouldn't even call it news.
2070,they shouldn't even call it news.,last night they told us about a cat in a sofa.
2071,last night they told us about a cat in a sofa.,yesterday they told us about a dog in a pipe.
2072,yesterday they told us about a dog in a pipe.,last week they told us about a bear in a back yard.
2073,last week they told us about a bear in a back yard.,last month they told us about a mouse in a restaurant.
2074,last month they told us about a mouse in a restaurant.,the weatherman tells us the temperature in every town.
2075,the weatherman tells us the temperature in every town.,the sports guy shows us players fighting.
2076,the sports guy shows us players fighting.,"they always tell us ""what's next."""
2077,"they always tell us ""what's next.""","they always make ""what's next"" sound exciting, but it never is."
2078,"they always make ""what's next"" sound exciting, but it never is.",it's more like news for kids.
2079,it's more like news for kids.,they should have kid reporters.
2080,i love my computer.,computers are so cool.
2081,computers are so cool.,i love to go online.
2082,i love to go online.,the internet is amazing.
2083,the internet is amazing.,you can travel all over the world.
2084,you can travel all over the world.,i know. i went to china yesterday.
2085,i know. i went to china yesterday.,what did you do?
2086,what did you do?,i stood on the great wall and looked all around.
2087,i stood on the great wall and looked all around.,what was it like?
2088,what was it like?,it was like the real thing.
2089,it was like the real thing.,it was like being there?
2090,it was like being there?,"yes, i felt like i was actually there."
2091,the beatles are the best.,they are the best musical group ever.
2092,they are the best musical group ever.,i love all their songs.
2093,i love all their songs.,i don't know which one i like the best.
2094,i don't know which one i like the best.,i like the ones i can sing along with.
2095,i like the ones i can sing along with.,"so do i, like ""she loves you."""
2096,"so do i, like ""she loves you.""","she loves you, yeah, yeah, yeah!..."
2097,"she loves you, yeah, yeah, yeah!...",and you know you should be glad!
2098,and you know you should be glad!,what a great song.
2099,what a great song.,"how about ""let it be?"""
2100,"how about ""let it be?""","oh, yes! ""let it be, let it be"""
2101,"oh, yes! ""let it be, let it be""","there will be an answer, let it be!"
2102,let's go to a movie.,i'd rather not.
2103,i'd rather not.,why not?
2104,why not?,you know i don't like crowds.
2105,you know i don't like crowds.,let's go to an early movie.
2106,let's go to an early movie.,"okay, that won't be very crowded."
2107,"okay, that won't be very crowded.",what would you like to see?
2108,what would you like to see?,"oh, i don't care. you're the one who wants to go out."
2109,"oh, i don't care. you're the one who wants to go out.","well, i want to see ""the pursuit of happyness."""
2110,"well, i want to see ""the pursuit of happyness.""",what have you heard about it?
2111,what have you heard about it?,it's based on a true story about a divorced man and his young son.
2112,it's based on a true story about a divorced man and his young son.,"well, i hope it has a happy ending."
2113,what's your favorite thing to do?,i like to watch people.
2114,i like to watch people.,that's your favorite thing to do?
2115,that's your favorite thing to do?,"well, it's one of them."
2116,"well, it's one of them.",where do you go to watch people?
2117,where do you go to watch people?,my girlfriend and i sit outside starbucks.
2118,my girlfriend and i sit outside starbucks.,that sounds like a good spot.
2119,that sounds like a good spot.,we watch people walk by with their dogs.
2120,we watch people walk by with their dogs.,i guess you see lots of different dogs.
2121,i guess you see lots of different dogs.,we don't even know what kind most of them are.
2122,we don't even know what kind most of them are.,"there are lots of different kinds, but they all have one thing in common."
2123,"there are lots of different kinds, but they all have one thing in common.","yes, they love to sniff each other when they meet."
2124,they call him father dollar bill.,"yes, he was on the tv news today."
2125,"yes, he was on the tv news today.",every easter sunday he gives away money.
2126,every easter sunday he gives away money.,is it his money?
2127,is it his money?,no. movie stars give him money to give to homeless people.
2128,no. movie stars give him money to give to homeless people.,how much money does he give away?
2129,how much money does he give away?,"this year he gave away $15,000."
2130,"this year he gave away $15,000.",that's a lot of money.
2131,that's a lot of money.,he gave $100 to people in wheelchairs.
2132,he gave $100 to people in wheelchairs.,what about the other homeless people?
2133,what about the other homeless people?,they got $1 each.
2134,they got $1 each.,people stood in line just to get one dollar?!
2135,old movies are the best.,even though they're in black and white.
2136,even though they're in black and white.,a good story is more important than color.
2137,a good story is more important than color.,actors didn't curse back then.
2138,actors didn't curse back then.,and there was no violence.
2139,and there was no violence.,people today don't like that.
2140,people today don't like that.,"no, today people like lots of action."
2141,"no, today people like lots of action.",i like a good story.
2142,i like a good story.,i like to see actors who are like real people.
2143,i like to see actors who are like real people.,like real people with real problems.
2144,like real people with real problems.,they still make movies like that.
2145,they still make movies like that.,"yes, but they never make much money."
2146,do you get pbs on tv?,"yes, everybody gets the public broadcasting system."
2147,"yes, everybody gets the public broadcasting system.",it puts me to sleep.
2148,it puts me to sleep.,tell me about it.
2149,tell me about it.,a gardening show follows a knitting show.
2150,a gardening show follows a knitting show.,a cooking show follows a sewing show.
2151,a cooking show follows a sewing show.,a travel show follows another travel show.
2152,a travel show follows another travel show.,i'll say! i've gone around the world a dozen times already!
2153,i'll say! i've gone around the world a dozen times already!,now they're adding old tv shows to the old movies.
2154,now they're adding old tv shows to the old movies.,i sure would like to see something interesting for a change.
2155,i sure would like to see something interesting for a change.,"if more people donate money, pbs could offer new shows."
2156,"if more people donate money, pbs could offer new shows.",who wants to donate? public tv should be free.
2157,"i love to watch ""judge judy.""",is that a tv show?
2158,is that a tv show?,yes. it's on every afternoon.
2159,yes. it's on every afternoon.,what's so good about it?
2160,what's so good about it?,they have interesting lawsuits.
2161,they have interesting lawsuits.,such as?
2162,such as?,"yesterday, a woman complained about a cell phone she bought on ebay."
2163,"yesterday, a woman complained about a cell phone she bought on ebay.",was something wrong with the phone?
2164,was something wrong with the phone?,it works only in canada.
2165,it works only in canada.,did the seller know that?
2166,did the seller know that?,"yes, and he didn't tell the buyer."
2167,"yes, and he didn't tell the buyer.",i hope judge judy made the seller take the phone back.
2168,that woman is a very good singer.,"yes, but she looks like a man."
2169,"yes, but she looks like a man.",what difference does it make?
2170,what difference does it make?,female singers are supposed to be pretty.
2171,female singers are supposed to be pretty.,singers are supposed to sound good.
2172,singers are supposed to sound good.,"they should look good, too."
2173,"they should look good, too.",there are lots of ugly men singers.
2174,there are lots of ugly men singers.,men singers don't have to look good.
2175,men singers don't have to look good.,then neither do women singers.
2176,then neither do women singers.,"well, i would never buy her cd."
2177,"well, i would never buy her cd.",but you would buy her cd if she was pretty?
2178,but you would buy her cd if she was pretty?,yes. i would buy all of her cds.
2179,all the tv stations are going to go digital.,"yes, that will occur next month."
2180,"yes, that will occur next month.",most of them are already broadcasting in digital.
2181,most of them are already broadcasting in digital.,the digital signal is very clear.
2182,the digital signal is very clear.,"oh, no, it isn't!"
2183,"oh, no, it isn't!",what do you mean?
2184,what do you mean?,i can't get a single channel.
2185,i can't get a single channel.,do you have a digital tv?
2186,do you have a digital tv?,of course. but i don't have cable.
2187,of course. but i don't have cable.,"you don't need to have cable, but you do need a good antenna."
2188,"you don't need to have cable, but you do need a good antenna.",but i have rabbit ears.
2189,but i have rabbit ears.,rabbit ears aren't strong enough. buy a digital antenna.
2190,i've got a date for you.,"oh, really?"
2191,"oh, really?",are you interested?
2192,are you interested?,maybe. what is she like?
2193,maybe. what is she like?,she's got a great personality.
2194,she's got a great personality.,uh-oh. that means that she's fat and ugly.
2195,uh-oh. that means that she's fat and ugly.,she's cute.
2196,she's cute.,"okay, so she's not ugly; she's just fat."
2197,"okay, so she's not ugly; she's just fat.",she weighs 98 pounds.
2198,she weighs 98 pounds.,"okay, she's not fat. so what's the problem with her?"
2199,"okay, she's not fat. so what's the problem with her?",who said there is a problem with her?
2200,who said there is a problem with her?,the problem is she has no problemsshe's too good for me!
2201,i think you're very pretty.,thank you.
2202,thank you.,would you have dinner with me?
2203,would you have dinner with me?,i would like to.
2204,i would like to.,can i pick you up friday night?
2205,can i pick you up friday night?,what time?
2206,what time?,eight o'clock.
2207,eight o'clock.,that sounds great.
2208,that sounds great.,we'll go to a french restaurant.
2209,we'll go to a french restaurant.,i've never been to a french restaurant.
2210,i've never been to a french restaurant.,i think you'll love the food.
2211,i think you'll love the food.,i'm not going to eat any snails!
2212,you have pretty eyes.,thank you. so do you.
2213,thank you. so do you.,i wish my eyes were blue.
