Index,question,answer
694,"i'm not being nosey, it's just a question.",you don't need to worry about that.
695,you don't need to worry about that.,that was mean to say.
696,that was mean to say.,"i am very sorry, but i must go."
697,"well, it was nice talking to you.",it was nice talking to you too.
698,it was nice talking to you too.,we should really hang out again.
699,we should really hang out again.,that would be fun.
700,that would be fun.,where do you want to go?
701,where do you want to go?,i think we should go out to eat.
702,i think we should go out to eat.,that sounds good.
703,that sounds good.,"all right, so i'll see you then."
704,"all right, so i'll see you then.",i'll call you later.
705,i'll call you later.,"okay, i'll talk to you later then."
706,"okay, i'll talk to you later then.",see you later.
707,see you later.,bye.
708,i enjoyed talking to you.,i enjoyed talking to you too.
709,i enjoyed talking to you too.,we should hang out some time.
710,we should hang out some time.,i think that would be nice.
711,i think that would be nice.,is there anything you would like to do next time?
712,is there anything you would like to do next time?,do you want to go out to eat?
713,do you want to go out to eat?,i'd like that.
714,i'd like that.,so i'll see you next time.
715,so i'll see you next time.,i'm going to call you soon.
716,i'm going to call you soon.,i'll talk to you later.
717,i'll talk to you later.,see you soon.
718,see you soon.,goodbye.
719,i had fun talking to you.,it was really nice talking to you also.
720,it was really nice talking to you also.,i think we should really do something sometime.
721,i think we should really do something sometime.,that should be loads of fun.
722,that should be loads of fun.,what do you want to do next time?
723,what do you want to do next time?,would you like to go to dinner or something?
724,would you like to go to dinner or something?,"yeah, let's do that."
725,"yeah, let's do that.","okay, until next time then."
726,"okay, until next time then.",i'll call you so we can set that up.
727,i'll call you so we can set that up.,talk to you then.
728,talk to you then.,"all right, see you."
729,where do you live?,i live in pasadena.
730,i live in pasadena.,where is pasadena?
731,where is pasadena?,it's in california.
732,it's in california.,is it in northern california?
733,is it in northern california?,no. it's in southern california.
734,no. it's in southern california.,is pasadena a big city?
735,is pasadena a big city?,it's pretty big.
736,it's pretty big.,"how big is ""pretty big""?"
737,"how big is ""pretty big""?","it has about 140,000 people."
738,"it has about 140,000 people.",how big is los angeles?
739,how big is los angeles?,it has about 3 million people.
740,do you have a car?,"yes, i do."
741,"yes, i do.",what kind of car do you have?
742,what kind of car do you have?,i have a honda.
743,i have a honda.,is it new?
744,is it new?,it was new in 2003.
745,it was new in 2003.,"so, it's pretty old now."
746,"so, it's pretty old now.","yes, it is. but it still looks good."
747,"yes, it is. but it still looks good.",do you take good care of it?
748,do you take good care of it?,"oh, yes. i wash it once a week."
749,"oh, yes. i wash it once a week.",do you change the oil?
750,do you change the oil?,my mechanic changes the oil twice a year.
751,do you have a girlfriend?,"no, i don't. do you?"
752,"no, i don't. do you?","i don't have a girlfriend, either."
753,"i don't have a girlfriend, either.",why not?
754,why not?,i don't know. maybe i'm not rich enough.
755,i don't know. maybe i'm not rich enough.,girls like guys with money.
756,girls like guys with money.,they sure do.
757,they sure do.,they like guys with new cars.
758,they like guys with new cars.,i don't have money or a new car.
759,i don't have money or a new car.,"me, neither."
760,"me, neither.",but girls like guys who are funny.
761,but girls like guys who are funny.,maybe we should learn some good jokes.
762,where are you going?,i have to walk the dog.
763,i have to walk the dog.,what kind of dog do you have?
764,what kind of dog do you have?,i have a little poodle.
765,i have a little poodle.,poodles bark a lot.
766,poodles bark a lot.,they sure do.
767,they sure do.,they bark at everything.
768,they bark at everything.,they never shut up.
769,they never shut up.,why did you get a poodle?
770,why did you get a poodle?,it's my mom's dog.
771,it's my mom's dog.,so she likes poodles.
772,so she likes poodles.,she says they're good watchdogs.
773,can i borrow $5?,sure. why do you need it?
774,sure. why do you need it?,i want to buy lunch.
775,i want to buy lunch.,where's your money?
776,where's your money?,it's not in my wallet.
777,it's not in my wallet.,your wallet is empty?
778,your wallet is empty?,i don't have even one dollar in it.
779,i don't have even one dollar in it.,being broke is no fun.
780,being broke is no fun.,even if it's only for a short while.
781,even if it's only for a short while.,it's always good to have friends.
782,it's always good to have friends.,friends will lend you money when you're broke.
783,friends will lend you money when you're broke.,as long as you pay them back.
784,let's go to the beach.,that's a great idea.
785,that's a great idea.,we haven't been in a while.
786,we haven't been in a while.,we haven't been in a month.
787,we haven't been in a month.,"the last time we went, you almost drowned."
788,"the last time we went, you almost drowned.","no, i didn't."
789,"no, i didn't.",then why did the lifeguard dive into the water?
790,then why did the lifeguard dive into the water?,i think he wanted to cool off.
791,i think he wanted to cool off.,he swam right up to you.
792,he swam right up to you.,and then he turned right around.
793,and then he turned right around.,maybe you're right.
794,maybe you're right.,maybe we should get going.
795,are you married?,no. i'm divorced.
796,no. i'm divorced.,when did you get divorced?
797,when did you get divorced?,i got divorced two years ago.
798,i got divorced two years ago.,why did you get divorced?
799,why did you get divorced?,my wife left me.
800,my wife left me.,why did she leave you?
801,why did she leave you?,she said she didn't love me anymore.
802,she said she didn't love me anymore.,wow! that's terrible.
803,wow! that's terrible.,"yes, it was."
804,"yes, it was.",why didn't she love you anymore?
805,why didn't she love you anymore?,she fell in love with my best friend.
806,i'm bored.,what's on tv?
807,what's on tv?,nothing.
808,nothing.,there must be something on tv!
809,there must be something on tv!,nothing that's interesting.
810,nothing that's interesting.,what about that new game show?
811,what about that new game show?,which one?
812,which one?,deal or no deal
813,deal or no deal,tell me you're joking.
814,tell me you're joking.,i love that show.
815,i love that show.,i watched it once. that was enough.
816,i watched it once. that was enough.,it's on right now. let's watch it together.
817,i like living here.,i agree. pasadena is a nice city.
818,i agree. pasadena is a nice city.,it's not too big.
819,it's not too big.,and it's not too small.
820,and it's not too small.,it has great weather all year long.
821,it has great weather all year long.,it has the rose parade.
822,it has the rose parade.,it has beautiful houses.
823,it has beautiful houses.,it has wonderful restaurants.
824,it has wonderful restaurants.,it has great schools.
825,it has great schools.,it's close to the mountains.
826,it's close to the mountains.,the people are friendly.
827,the people are friendly.,i'm not ever going to leave.
828,we need a new mattress.,what's the matter with this one?
829,what's the matter with this one?,it's not comfortable.
830,it's not comfortable.,it seems fine to me.
831,it seems fine to me.,i toss and turn all night.
832,i toss and turn all night.,you should stop drinking coffee.
833,you should stop drinking coffee.,look at these marks on my arms.
834,look at these marks on my arms.,what are they?
835,what are they?,they are bites.
836,they are bites.,did the cat bite you?
837,did the cat bite you?,no. the bedbugs in that mattress bit me.
838,no. the bedbugs in that mattress bit me.,okay. let's get a new mattress.
839,my laptop is so slow.,buy a new one.
840,buy a new one.,i would if i had the money.
841,i would if i had the money.,why is it so slow?
842,why is it so slow?,that's a good question.
843,that's a good question.,did you take it to a computer shop?
844,did you take it to a computer shop?,i would if i had the money.
845,i would if i had the money.,"well, i guess you have to live with it."
846,"well, i guess you have to live with it.",sometimes i want to throw it out the window.
847,sometimes i want to throw it out the window.,you don't want to do that.
848,you don't want to do that.,why not?
849,why not?,you might hit someone in the head.
850,what's for dinner?,i'm not sure.
851,i'm not sure.,how about a pizza?
852,how about a pizza?,you had pizza for lunch.
853,you had pizza for lunch.,but i love pizza.
854,but i love pizza.,everybody loves pizza.
855,everybody loves pizza.,so why can't i have pizza for dinner?
856,so why can't i have pizza for dinner?,because you need variety.
857,because you need variety.,"what's ""variety?"
858,"what's ""variety?",different thingsnot the same thing all the time.
859,different thingsnot the same thing all the time.,"you mean, like a pepperoni pizza instead of a cheese pizza?"
860,"you mean, like a pepperoni pizza instead of a cheese pizza?","no, i mean a salad instead of a pizza."
861,we need to save money.,why do we need to save money?
862,why do we need to save money?,because we need to buy a house.
863,because we need to buy a house.,but a house is so expensive.
864,but a house is so expensive.,that's why we need to save money.
865,that's why we need to save money.,how much do we need to save?
866,how much do we need to save?,we need to save enough for a down payment.
867,we need to save enough for a down payment.,how much is that?
868,how much is that?,"that's about $30,000."
869,"that's about $30,000.",thirty thousand dollars! that will take forever.
870,thirty thousand dollars! that will take forever.,not if we save every penny.
871,not if we save every penny.,okay. here's seven pennies.
872,the ocean is so big.,you can't see the end of it.
873,you can't see the end of it.,it goes on and on forever.
874,it goes on and on forever.,"and it's deep, too."
875,"and it's deep, too.",i think it's five miles deep.
876,i think it's five miles deep.,are there fish at the bottom?
877,are there fish at the bottom?,there are fish at the top and the bottom.
878,there are fish at the top and the bottom.,are there more fish or more people?
879,are there more fish or more people?,i think there are more fish.
880,i think there are more fish.,i hope so. i love to eat fish.
881,i'm upset with my mom.,why is that?
882,why is that?,i warned her about her new boyfriend. she didn't listen to me.
883,i warned her about her new boyfriend. she didn't listen to me.,what happened?
884,what happened?,"i gave her $1,000 for her birthday. i told her to spend it on herself."
885,"i gave her $1,000 for her birthday. i told her to spend it on herself.",that was very nice of you.
886,that was very nice of you.,i found out that she gave it to her new boyfriend.
887,i found out that she gave it to her new boyfriend.,why did she do that?
888,why did she do that?,he said he would buy her a nice ring.
889,he said he would buy her a nice ring.,what's wrong with that?
890,what's wrong with that?,he went to las vegas. he lost it all gambling.
891,he went to las vegas. he lost it all gambling.,i hope your mom broke up with him.
892,do animals talk to each other?,of course they talk to each other.
893,of course they talk to each other.,what do they talk about?
894,what do they talk about?,they talk about other animals.
895,they talk about other animals.,what else do they talk about?
896,what else do they talk about?,they talk about food and the weather.
897,they talk about food and the weather.,do they talk about us?
898,do they talk about us?,of course they talk about us.
899,of course they talk about us.,what do they say about us?
900,what do they say about us?,they say that we are funny-looking.
901,they say that we are funny-looking.,ha! we're not funny-looking; animals are funny-looking.
902,ha! we're not funny-looking; animals are funny-looking.,we're funny-looking because we wear clothes.
903,i have to clean the house.,"yes, it's very dirty."
904,"yes, it's very dirty.",you can help me.
905,you can help me.,why me?
906,why me?,because you helped make it dirty.
907,because you helped make it dirty.,what do you want me to do?
908,what do you want me to do?,i want you to clean the bathroom.
909,i want you to clean the bathroom.,"oh, that's easy."
910,"oh, that's easy.","clean the sink, the tub, the counter, and the toilet."
911,"clean the sink, the tub, the counter, and the toilet.",that's a lot of work.
912,that's a lot of work.,tell me when you finish.
913,tell me when you finish.,i don't think so. you'll just give me more work.
914,you're watching too much tv.,what do you mean?
915,what do you mean?,i mean you're wasting your life.
916,i mean you're wasting your life.,i'm having fun.
917,i'm having fun.,you're sitting there with your mouth open.
918,you're sitting there with your mouth open.,who cares?
919,who cares?,i care. do something.
920,i care. do something.,okay. i did something.
921,okay. i did something.,what did you do?
922,what did you do?,i turned up the volume.
923,i turned up the volume.,"that's not what i meant by ""do something."""
924,"that's not what i meant by ""do something.""",will you do something? leave me alone.
925,did you write a letter to grandma?,"yes, i did."
926,"yes, i did.",did you tell her about school?
927,did you tell her about school?,i told her that school is fun.
928,i told her that school is fun.,did you put the letter in an envelope?
929,did you put the letter in an envelope?,"yes, and i sealed the envelope."
930,"yes, and i sealed the envelope.",did you put a stamp on the envelope?
931,did you put a stamp on the envelope?,i couldn't find any stamps.
932,i couldn't find any stamps.,they're in the kitchen drawer.
933,they're in the kitchen drawer.,okay. i just put a stamp on the envelope.
934,okay. i just put a stamp on the envelope.,"give me the envelope, and i'll mail it for you."
935,"give me the envelope, and i'll mail it for you.",when is grandma going to learn about e-mail?
936,why are you yawning?,i'm sleepy.
937,i'm sleepy.,why don't you go to bed?
938,why don't you go to bed?,i want to watch this tv show.
939,i want to watch this tv show.,maybe you should record it.
940,maybe you should record it.,the tape recorder is broken.
941,the tape recorder is broken.,then you should watch the rerun.
942,then you should watch the rerun.,why? i'm watching the original.
943,why? i'm watching the original.,but you'll be asleep in about one minute.
944,but you'll be asleep in about one minute.,i'm just yawning because the commercials are on.
945,i'm just yawning because the commercials are on.,okay. i'll tell you how the show ends.
946,okay. i'll tell you how the show ends.,zzz.
947,it's sunday.,so?
948,so?,you know what that means.
949,you know what that means.,i forgot.
950,i forgot.,sunday means we go to church.
951,sunday means we go to church.,"oh, yeah."
952,"oh, yeah.",put on a coat and tie.
953,put on a coat and tie.,why?
954,why?,to show respect to god and others.
955,to show respect to god and others.,i'm glad sunday is only once a week.
956,i'm glad sunday is only once a week.,i hope god didn't hear that.
957,i hope god didn't hear that.,he'll forgive me.
958,did you feed the cat?,i'll do that in a minute.
959,i'll do that in a minute.,the cat is meowing. he's hungry.
960,the cat is meowing. he's hungry.,okay. i'll feed him right now.
961,okay. i'll feed him right now.,you shouldn't make him wait.
962,you shouldn't make him wait.,i was doing my homework.
963,i was doing my homework.,the cat doesn't care about your homework.
964,the cat doesn't care about your homework.,the cat doesn't care about anything.
965,the cat doesn't care about anything.,that's the way cats are.
966,that's the way cats are.,all they think about is themselves.
967,all they think about is themselves.,maybe we should get rid of him.
968,maybe we should get rid of him.,of course not! he's family.
969,i hate shaving.,me too.
970,me too.,i just cut myself again.
971,i just cut myself again.,did you use a new blade?
972,did you use a new blade?,"it doesn't matter. old blades cut, new blades cut."
973,"it doesn't matter. old blades cut, new blades cut.",maybe you should use an electric shaver.
974,maybe you should use an electric shaver.,"they make a lot of noise, but they don't give a close shave."
975,"they make a lot of noise, but they don't give a close shave.",maybe you should stop shaving.
976,maybe you should stop shaving.,and grow a beard?
977,and grow a beard?,sure. why not?
978,sure. why not?,because food and other stuff sticks in my beard.
979,because food and other stuff sticks in my beard.,hmm. here's an idea. put cream on your face and have the cat lick it off.
980,excuse me.,yes?
981,yes?,are you reading this paper?
982,are you reading this paper?,"oh, no. help yourself."
983,"oh, no. help yourself.",i asked because the paper is sitting next to you.
984,i asked because the paper is sitting next to you.,thank you. that's polite of you to ask.
985,thank you. that's polite of you to ask.,some people would just pick it up.
986,some people would just pick it up.,"yes, i know. some people are rude."
987,"yes, i know. some people are rude.",i always try to be polite.
988,i always try to be polite.,so do i.
989,so do i.,the world needs more polite people like us.
990,the world needs more polite people like us.,i agree 100 percent.
991,"mom, i want a puppy.",let me think about it.
992,let me think about it.,why do you have to think about it?
993,why do you have to think about it?,because a puppy costs money.
994,because a puppy costs money.,"no, it doesn't. puppies are free."
995,"no, it doesn't. puppies are free.","yes, but a puppy needs shots."
996,"yes, but a puppy needs shots.",shots for what?
997,shots for what?,so it won't get sick. just like you get shots.
998,so it won't get sick. just like you get shots.,i hate shots.
999,i hate shots.,and a puppy eats food. food costs money.
1000,and a puppy eats food. food costs money.,no problem. i'll give him food off my plate.
1001,no problem. i'll give him food off my plate.,"oh, no you don't. puppies don't eat vegetables."
1002,look at all these kittens!,how many are there?
1003,how many are there?,eight.
1004,eight.,they're all so cute.
1005,they're all so cute.,"yes, but i can't keep them."
1006,"yes, but i can't keep them.",what are you going to do with them?
1007,what are you going to do with them?,i'm going to give them away. do you want one?
1008,i'm going to give them away. do you want one?,"yes, i would love one."
1009,"yes, i would love one.",which one do you want?
1010,which one do you want?,that one. the one that's all black.
1011,that one. the one that's all black.,"yes, i like that one, too."
1012,"yes, i like that one, too.",i'll call him blacky.
1013,my parents go to church every sunday.,they trust in god.
1014,they trust in god.,they hope they will go to heaven.
1015,they hope they will go to heaven.,they probably will.
1016,they probably will.,but no one knows for sure.
1017,but no one knows for sure.,that's for sure.
1018,that's for sure.,no one knows what happens after we die.
1019,no one knows what happens after we die.,"if we are good, we will be happy in heaven with god."
1020,"if we are good, we will be happy in heaven with god.",that's what many people believe.
1021,that's what many people believe.,"if we are bad, we will be unhappy forever in hell."
1022,"if we are bad, we will be unhappy forever in hell.",i don't want to go to hell.
1023,i don't want to go to hell.,let's go to church with your parents on sunday.
1024,my husband died.,i'm sorry for you.
1025,i'm sorry for you.,thank you.
1026,thank you.,when did he die?
1027,when did he die?,a couple of months ago.
1028,a couple of months ago.,you still miss him.
1029,you still miss him.,"yes, but i talk to him almost every day."
1030,"yes, but i talk to him almost every day.",when you go to church?
1031,when you go to church?,"no, when i call him on his cell phone."
1032,"no, when i call him on his cell phone.",what do you mean?
1033,what do you mean?,i buried him with his cell phone.
1034,i buried him with his cell phone.,what will you do when the battery dies?
1035,today is friday the thirteenth.,that's a bad day.
1036,that's a bad day.,it's supposed to be unlucky.
1037,it's supposed to be unlucky.,you're supposed to stay home all day.
1038,you're supposed to stay home all day.,that's what i do.
1039,that's what i do.,my friend stayed in a hotel on friday the thirteenth.
1040,my friend stayed in a hotel on friday the thirteenth.,that was a mistake.
1041,that was a mistake.,he stayed on the thirteenth floor.
1042,he stayed on the thirteenth floor.,what happened?
1043,what happened?,someone stole his laptop.
1044,someone stole his laptop.,he was asking for it.
1045,he was asking for it.,he learned his lesson. he's home today.
1046,do you really love me?,of course.
1047,of course.,prove it.
1048,prove it.,how can i prove it?
1049,how can i prove it?,take me to dinner.
1050,take me to dinner.,that's it? that's all i have to do?
1051,that's it? that's all i have to do?,"take me to a nice restaurant, not to mcdonald's."
1052,"take me to a nice restaurant, not to mcdonald's.",but a nice restaurant costs money.
1053,but a nice restaurant costs money.,"yes, and you have to make a reservation."
1054,"yes, and you have to make a reservation.",that's such a hassle.
1055,that's such a hassle.,i knew you didn't love me.
1056,i knew you didn't love me.,"okay, okay! i'll make a reservation right now."
1057,my parents are divorced.,so are mine.
1058,so are mine.,why did your parents get divorced?
1059,why did your parents get divorced?,my father found a new girlfriend.
1060,my father found a new girlfriend.,that's too bad.
1061,that's too bad.,my mother was hurt and angry.
1062,my mother was hurt and angry.,she had good reason. what did she do?
1063,she had good reason. what did she do?,she told him to drop his girlfriend.
1064,she told him to drop his girlfriend.,what did your father do?
1065,what did your father do?,he moved out of our house.
1066,he moved out of our house.,i guess he really liked his new girlfriend.
1067,i guess he really liked his new girlfriend.,"yes, but she left him a year later."
1068,my grandma's apartment smells funny.,so does mine.
1069,so does mine.,i think it's an old people's smell.
1070,i think it's an old people's smell.,really?
1071,really?,"yes. i think when you get old, you begin to smell."
1072,"yes. i think when you get old, you begin to smell.",like fruit that is too ripe?
1073,like fruit that is too ripe?,"yes, just like fruit that is too ripe."
1074,"yes, just like fruit that is too ripe.",but the smell is different.
1075,but the smell is different.,"yes, old people don't smell like fruit."
1076,"yes, old people don't smell like fruit.","no, they smell like a thrift shop."
1077,"no, they smell like a thrift shop.","yes, a thrift shop has that same smell."
1078,"yes, a thrift shop has that same smell.","yes, an old smell."
1079,the price of stamps goes up and up.,i think stamps used to cost a penny.
1080,i think stamps used to cost a penny.,that was a long time ago.
1081,that was a long time ago.,it was before i was born.
1082,it was before i was born.,now a stamp is 42 cents.
1083,now a stamp is 42 cents.,but in may it will be 44 cents.
1084,but in may it will be 44 cents.,have you ever lost a letter in the mail?
1085,have you ever lost a letter in the mail?,"no, i haven't."
1086,"no, i haven't.",neither have i.
1087,neither have i.,"so, they do a good job for the money."
1088,"so, they do a good job for the money.","yes, they do."
1089,"yes, they do.",maybe we shouldn't complain.
1090,a button came off my shirt.,what are you going to do?
1091,what are you going to do?,"first, i have to find the button."
1092,"first, i have to find the button.",where did you lose it?
1093,where did you lose it?,i have no idea.
1094,i have no idea.,a button is hard to find. did you look in your pant cuffs?
1095,a button is hard to find. did you look in your pant cuffs?,that's a good idea.
1096,that's a good idea.,i found a button in my pant cuffs one time.
1097,i found a button in my pant cuffs one time.,"let me look. no, it's not there."
1098,"let me look. no, it's not there.",many shirts come with an extra button.
1099,many shirts come with an extra button.,you're right. this one does have an extra button.
1100,you're right. this one does have an extra button.,now all you have to do is sew it on.
1101,i have to go to the bathroom.,you drink too much coffee.
1102,you drink too much coffee.,but i love coffee.
1103,but i love coffee.,"well, it's your life."
1104,"well, it's your life.",you eat too much chocolate.
1105,you eat too much chocolate.,i don't think so.
1106,i don't think so.,have you looked in the mirror?
1107,have you looked in the mirror?,do you think i'm getting fat?
