Index,Task,Time,Date,Status
|1, ers directly on your device, but I can suggest some options. You can set a reminder on your phone's calendar app, use a reminder app, write it down on a sticky note, or create a task in a to-do list app. Just set the reminder for tomorrow evening to clean the truck., 18:00, Saturday, Open|
|1,  you to take out the garbage in the evening. Do you have a specific time in mind, or should I just remind you in the evening?, 18:00, Saturday, Open|
|1, ers, but I suggest you set an alarm on your phone to help you remember to take the garbage out this evening., 18:00, Saturday, Open|
|1, , 12:00, Saturday, Open|
|1, , 12:00, Saturday, Open|
